{
  "K": {
    "prior_knowledge": [],
    "confidence": {
      "testing": 0.5
    },
    "skills_available": [
      "kstar-loop"
    ]
  },
  "S": {
    "S_A": {
      "id": "test-user",
      "role": "developer"
    },
    "S_D": {
      "objective": "Test NEOLAF plugin",
      "domain_type": "testing"
    },
    "S_P": {
      "mode": "LEARNING",
      "current_stage": "execute"
    },
    "S_N": {
      "timestamp": "2026-01-19T09:47:55.200028+00:00"
    }
  },
  "T": {
    "id": "task_001",
    "goal": "Verify NEOLAF plugin works correctly",
    "success_criteria": [
      "Plugin validates",
      "Commands load",
      "Database works"
    ]
  },
  "A": {
    "plan": {
      "actions": [
        {
          "type": "test",
          "description": "Run validation"
        }
      ]
    },
    "forecast": {
      "expected_outcome": "success",
      "success_probability": 0.9
    }
  },
  "R": {
    "observation": {
      "success": true,
      "outputs": {
        "status": "all tests passed"
      }
    },
    "prediction_error": 0.1,
    "learning": {
      "lessons": [
        "NEOLAF plugin structure is correct"
      ]
    }
  },
  "metadata": {
    "tags": [
      "test",
      "plugin-validation"
    ],
    "created_at": "2026-01-19T09:47:55.200241+00:00",
    "version": "1.0.0"
  },
  "id": "kstar_353f14d3-1504-454c-99b0-56d6e4ba83a2"
}